{
  "spec": "2origin/0.2",
  "kind": "task.origin",
  "id": "agentteams-bridge",
  "title": "把本源 AI 计算机接到 AgentTeams 上：发证分离闸门",
  "goal": "验证一件事：本仓库的治理理念（作者不能给自己发证、观察器不收预期、投影必须披露丢了什么、可审计性来自我们控制不了的东西）能不能在一个第三方多 Agent 平台上成立。落地物是发证分离闸门——学历里的 verified 从此必须带考官身份，且考官身份由平台签发而非进程自称。",
  "current_state": "【GOAI 初赛已结束】2026-08-16 20:47 完成第 3 次（手册规定的最后一次）提交并成功上传（用户 2026-08-19 当面确认；⚠ 盘上无平台回执物，依据是口头的，不是可复核证据）。提交包 2origin本象计算机-AgentInfra初赛提交包-v3-20260816.zip（10.6MB），必交两样齐备：作品简介 479 字 + 27 页方案 PPT（官方八章结构），另附 Agent Identity 清单、Skill 清单、MCP/RAG/可观测对照、开源披露、复跑记录。平台字段：代码仓库 github.com/dongsheng123132/2origin，Demo 2origin.org。材料里对评委作出的复赛承诺共 6 项、9.3 前交，最重的一条是「可独立运行的 AgentTeams 桥接包 + LICENSE」——当前 code-agentteams 快照依赖 southbridge/ 与 xuetang/，跑不起来，这一点材料里已如实写明。\n\n（以下为初赛前状态，保留）**客户 CAD 案例已升级到对象级回落复核。** 正式包 `cad-window-audit.origin` 保存 776 个对象、388 条关系、8/8 可机器判定约束与 198 条派生变更；194 个 TCH_OPENING 中 4 个为块定义，190 个实际放置对象拆为 168 窗、22 门、unknown=0，且 190/190 已恢复位置锚点。每个 `opening:<handle>` 可独立 `why`，位置由 `tch-opening-anchor-decoder` 派生事务写入并带 basis；交互 HTML 可搜索、点击、高亮回落脱敏原图。精确轮廓/朝向/bbox 尚未恢复，未夸大为已完成。公众号/GitHub 通用案例稿与封面已生成，AI 味 gate 12.2/100；全仓 `npm run verify` 0 失败。",
  "facts": [
    {
      "claim": "本仓库此前的「作者不能给自己发证」只检查有无考试通过记录，不检查考试是谁跑的——多 Agent 下 Worker 可自跑 exam 自发证",
      "verified": true,
      "source": "xuetang/learning-core.mjs 的 normalizeForWrite"
    },
    {
      "claim": "AgentTeams 的 Worker 身份由 Matrix homeserver 签发，可经 /_matrix/client/v3/account/whoami 向服务器求证，因此是一个我们控制不了的身份签发者",
      "verified": true,
      "source": "https://github.com/agentscope-ai/AgentTeams/blob/main/AGENTS.md"
    },
    {
      "claim": "发证分离闸门的判据套件在本机跑通 21 条全绿，其中 18 条是反向用例",
      "verified": true,
      "source": "node agentteams/verify-agentteams.mjs"
    },
    {
      "claim": "判据里的 homeserver 是本仓库自带的测试替身，因此本套绿灯只证明闸门逻辑成立，不证明身份已被外部锚定",
      "verified": true,
      "source": "agentteams/stub-homeserver.mjs"
    },
    {
      "claim": "Agent Infra 赛道必选 AgentTeams 框架，初赛截止 2026-08-16，只需作品简介与方案 PPT，可执行代码包在初赛为可选、复赛为必交",
      "verified": true,
      "source": "demo/agentteams-bridge/goai-infra-track.txt"
    },
    {
      "claim": "Agent Infra 评审五维权重为场景价值 25 / 多 Agent 协同 25 / Skill 工程体系 25 / 工程落地与安全可审计 20 / 开放开源 5",
      "verified": true,
      "source": "demo/agentteams-bridge/goai-infra-track.txt"
    },
    {
      "claim": "本机 Docker CLI 已装成 29.7.2，但 daemon 未起（npipe 连不上）；WSL 的 Ubuntu 发行版因 ext4.vhdx 缺失而不可用",
      "verified": true,
      "source": "demo/agentteams-bridge/env-probe.md"
    },
    {
      "claim": "旧路径下 Worker 可自考自判把经验写成 verified，学历里无任何字段能回答「谁发的证」，且北桥会将其作为已验证经验注入下一个会话——实弹退出码 1",
      "verified": true,
      "source": "node demo/agentteams-bridge/probe-multiagent-selfcert.mjs"
    },
    {
      "claim": "本机 Docker Desktop 安装实际失败（installer exited with status 1），Docker Inc. 的注册表键未写入、com.docker.service 未注册；Program Files 下的文件是半截残骸，因此 docker --version 有输出并不代表装成了",
      "verified": true,
      "source": "C:/Users/ZhuanZ/AppData/Local/Docker/log/host/Docker Desktop.exe.log"
    },
    {
      "claim": "本机 WSL2 本身已失效：新装的 Ubuntu 发行版 vhdx 已生成（1.4G）但启动一律 Wsl/Service/E_UNEXPECTED，wsl --update 卡在提权不返回",
      "verified": true,
      "source": "wsl -d Ubuntu -u root -e echo OK（见 demo/agentteams-bridge/env-probe.md）"
    },
    {
      "claim": "公共 Matrix homeserver 已基本全面关闭开放注册：13 个候选逐个用 Client-Server API 探测，0 个允许 m.login.dummy 注册，因此「第三方运营的身份签发者」这一级在本机不可达",
      "verified": true,
      "source": "demo/agentteams-bridge/matrix-registration-probe.md"
    },
    {
      "claim": "AgentTeams v1.2.2 已在本机 WSL2 Ubuntu 26.04 + Docker CE 29.7.2 上跑起来：manager / controller / dashboard 三容器，Matrix 网关 127.0.0.1:18080 返回 200",
      "verified": true,
      "source": "demo/agentteams-bridge/e2e-real-attestation.mjs"
    },
    {
      "claim": "用 AgentTeams 自带 Tuwunel 签发的两个真身份跑通端到端 7/7：作者拿自己的真令牌给自己发证被拒 self_certification 且学历零改动，换考官身份发证通过并把考官身份与签发者落盘，分离强度 attested_both，学历中无令牌泄露",
      "verified": true,
      "source": "node demo/agentteams-bridge/e2e-real-attestation.mjs"
    },
    {
      "claim": "这台 Tuwunel 上 appservice 独占整个用户名空间，持 root 直接 register 任意用户名一律 M_EXCLUSIVE——Worker 铸不出自己的身份是实测事实而非纸面设计",
      "verified": true,
      "source": "demo/agentteams-bridge/e2e-real-attestation.mjs"
    },
    {
      "claim": "WSL 的 .wslconfig vmIdleTimeout 不足以保住发行版：设成 8 小时后容器仍在每条命令退出约 16 秒后收到 SIGTERM 并重启，必须用一个脱离调用方会话的常驻进程（Start-Process -WindowStyle Hidden wsl ... sleep infinity）才钉得住",
      "verified": true,
      "source": "demo/agentteams-bridge/env-probe.md 与 docker logs agentteams-controller 的 SIGTERM 时间戳"
    },
    {
      "claim": "同一条教训（仪器失效不得读成被测对象属性）在同一天同一仓库复发三次：identity.mjs 的 unreachable 一格、判据框架 stub 同进程被阻塞、e2e 脚本遇 502 仍下判断；第三次已固化为退出码 3 的前置闸门",
      "verified": true,
      "source": "node demo/agentteams-bridge/e2e-real-attestation.mjs"
    },
    {
      "claim": "v0.1 的发证闸门漏了一格：考官自己跑考题又自己采信结果，是「作者给自己发证」换了位置。v0.2 拆出取象子命令，整个协议里只有 observe 会执行命令，certify 一行不跑（判据 O1 行为检查 + O1b 源码检查）",
      "verified": true,
      "source": "node agentteams/verify-agentteams.mjs"
    },
    {
      "claim": "三个真身份端到端 12/12：作者自证被拒、合法考官无观察也发不出证、作者不许自己观察、取象独立产出依据、考官读依据发证、三身份互不相同且都 attested、观察被核销防重放",
      "verified": true,
      "source": "node demo/agentteams-bridge/e2e-real-attestation.mjs"
    },
    {
      "claim": "判据 O1b 第一版对整段源码正则匹配 spawnSync，误伤了注释里引用的那句（注释正是在解释上一版曾有命令执行）——判据该测代码不该测散文，同 governance/verify-selfref.mjs 治的病",
      "verified": true,
      "source": "agentteams/verify-agentteams.mjs"
    },
    {
      "claim": "demo/book-project 是仓库里唯一的外部真实业务学历（广州中望龙腾高职教材，22 条已验证事实），核心判断是「教材主要成本不在写内容在保一致，而一致性人眼查不出脚本查得出」，已交付体检报告并量化到可报价",
      "verified": true,
      "source": "demo/book-project/task.origin.json"
    },
    {
      "claim": "教材/图纸/小说三个领域跑通同一条三 Agent 链，三个领域用同一个 certify.mjs、同一条闸门、同一份台账，换领域只换 recheck 指向哪个检查器，协议一行没改",
      "verified": true,
      "source": "node demo/agentteams-bridge/e2e-crossdomain.mjs"
    },
    {
      "claim": "此前判断「我们一张图纸都没处理过、4 天从零做 DXF 必翻车」是错的：本象协议 adapters/cad 已有可跑的 CAD 方言，55 条自测全过，能句柄驱动地分清移动/加长/删除，且对 DWG 给出可执行转换路径并警告勿用在线转换站",
      "verified": true,
      "source": "node adapters/cad/selftest.mjs（D:/uking编程/本象协议）"
    },
    {
      "claim": "这件事的海外行业标准词已核实：长文档一致性=cross-reference integrity check，教材编号=figure and table numbering audit，长篇小说=series bible continuity check，标书=RFP compliance matrix RTM；第四格有 FAR 15.203 法规锚点与 APMP 认证，客户本来就在为它付钱",
      "verified": false,
      "source": "降级为假设 2026-08-24：原 source 引用的 PDF（海外产品线分析-术语与GovCon合规矩阵.pdf，2026-08-10）已不在盘上（find 全仓与桌面均无此文件），断言不可复核。若找回原件可重新 verified。"
    },
    {
      "claim": "用同一判分器同一入口判三版红楼梦续写：重写本兑现 3、豆包版 4、我方 w4 12（共 25 条，违反均为 0）。人设六维量表把重写本判为 9.52 完胜豆包 5.42，而在唯一可机判的「判词命运落定」维上排序相反且差距在噪声量级",
      "verified": true,
      "source": "demo/agentteams-bridge/hongloumeng-three-way.md"
    },
    {
      "claim": "Agent Infra 初赛必交材料 v1 已生成：作品简介正文 410 字；11 页方案 PPTX 经最终文件重导入逐页渲染 11/11、几何越界 0；本轮闸门重跑 33/33（29 条反向用例）",
      "verified": true,
      "source": "agentteams/submission/SUBMISSION-QA.md"
    },
    {
      "claim": "2026-08-13 当前会话恢复 AgentTeams 常驻后，真 Tuwunel 三身份闭环重跑 12/12，教材/CAD/小说跨领域链重跑 3/3（跳过 0、失败 0）",
      "verified": true,
      "source": "node demo/agentteams-bridge/e2e-real-attestation.mjs && node demo/agentteams-bridge/e2e-crossdomain.mjs（2026-08-13）"
    },
    {
      "claim": "AgentTeams 运行时已固化为幂等 start / health / stop，实机完整走过启动、健康、停止、预期不健康、恢复在线；四层健康要求 WSL 专用常驻钉、Docker、三个容器和三个 HTTP 入口同时通过，故障注入判据 8/8",
      "verified": true,
      "source": "node agentteams/verify-runtime.mjs && node agentteams/runtime.mjs start && node agentteams/runtime.mjs health"
    },
    {
      "claim": "可执行代码包已补 README、配置样例和无密钥 selfcheck；默认自检 3/3、在线自检 4/4，出版社真实教材三身份 Trace 8/8，包含无观察拒证且学历零改动、独立取象、只读发证、防重放和无 token 泄露",
      "verified": true,
      "source": "node agentteams/selfcheck.mjs && node agentteams/selfcheck.mjs --live && node agentteams/demo-publishing.mjs"
    },
    {
      "claim": "A-101 CAD 能力测试图按门窗层闭合实体计数为 4 樘窗，而文字标注只有 3 个、唯一编号 2 个；C2 重号且第 4 樘漏编号。图文报告能逐樘落回实体、bbox 与稳定内容指纹；该图明确不是客户原图",
      "verified": true,
      "source": "node agentteams/cad-window-audit.mjs && node D:/uking编程/本象协议/adapters/cad/selftest.mjs（55/55）"
    },
    {
      "claim": "Agent Infra 路演演示版已生成 13 页：保留初赛原稿 11 页，新增 CAD 实体证据和运行/业务分账两页；最终文件重导入逐页渲染 13/13，slides_test 无溢出，模板保真检查 0 问题",
      "verified": true,
      "source": "agentteams/submission/AgentInfra-证据链-路演演示版.pptx；python slides_test.py；_codex_ppt_agentinfra_demo/qa/template-fidelity-check.json"
    },
    {
      "claim": "Agent Infra 路演证据可视化版已生成 17 页：在原有 CAD 证据之外，新增四层在线、出版社 Trace、真实身份/反向闸门和跨领域复用四页实跑截图；最终文件重导入逐页渲染 17/17，slides_test 无溢出，模板保真检查 0 问题",
      "verified": true,
      "source": "agentteams/submission/AgentInfra-证据链-路演演示版-证据可视化.pptx；_codex_ppt_agentinfra_visual/evidence-assets/evidence-data.json；python slides_test.py；_codex_ppt_agentinfra_visual/qa/template-fidelity-check.json"
    },
    {
      "claim": "客户厂房原始 DWG 经本机离线解析：ODA 抽出 194 个天正 TCH_OPENING，其中 4 个属于块定义，模型空间实际放置 190 个；代理载荷用途字段拆为 168 个窗对象、22 个门对象、unknown=0。GNU LibreDWG 独立确认 class 528 总数同为 194，但尚未独立完成 168/22 分类。168 是窗樘/窗洞对象，不是玻璃分格，并包含被建模为窗的百叶窗",
      "verified": true,
      "source": "node _codex_cad_lucheng/cad-count-summary.mjs；_codex_cad_lucheng/oda-openings.json；源 DWG SHA-256 2D28F2FDB31484B7522F6E16B2916A239E9C7132BD43EB48CBE063BB92737A56；GNU LibreDWG 0.14 class 528 count=194；ODA File Converter 27.1 TCH_OPENING count=194（2026-08-13）"
    },
    {
      "claim": "Agent Infra 客户 CAD 实证版已生成 18 页：新增第 17 页真实客户 DWG 的 168 窗 / 22 门离线解析截图，第 18 页仍为结论页；最终文件逐页渲染 18/18、slides_test 无溢出、模板保真检查 0 问题",
      "verified": true,
      "source": "agentteams/submission/AgentInfra-证据链-路演演示版-客户CAD实证.pptx；python slides_test.py；check_template_fidelity.mjs（2026-08-13）"
    },
    {
      "claim": "客户 CAD 已正式导入本象协议脱敏 `.origin` 包：585 个对象、388 条关系、6/6 可机器判定约束、6 条派生状态变更；windows=168 的 why 链指向 membership:window/*，diagnose 无 error。公开包不含客户名、原文件名、路径、图签、图纸文字或原始代理载荷；四张 WINDOW 图层几何投影无 TEXT/MTEXT/ATTRIB/块名并经视觉检查。全仓 npm run verify 通过",
      "verified": true,